{
  "$schema": "https://json-schema.org/draft/2020-12/schema",
  "$id": "https://github.com/sahilupadhyay/agent-engineering-marketplace/schemas/plugin.schema.json",
  "title": "Cursor plugin manifest",
  "description": "Per-plugin .cursor-plugin/plugin.json. Only documented Cursor fields are allowed. See https://cursor.com/docs/reference/plugins",
  "type": "object",
  "additionalProperties": false,
  "required": ["name"],
  "properties": {
    "name": {
      "type": "string",
      "pattern": "^[a-z0-9](?:[a-z0-9.-]*[a-z0-9])?$",
      "description": "Plugin identifier (kebab-case)."
    },
    "displayName": {
      "type": "string",
      "minLength": 1,
      "description": "Human-readable title shown in the Cursor plugin picker."
    },
    "description": { "type": "string" },
    "version": { "type": "string" },
    "author": {
      "type": "object",
      "additionalProperties": false,
      "required": ["name"],
      "properties": {
        "name": { "type": "string" },
        "email": { "type": "string", "format": "email" }
      }
    },
    "homepage": { "type": "string", "format": "uri" },
    "repository": { "type": "string", "format": "uri" },
    "license": { "type": "string" },
    "keywords": {
      "type": "array",
      "items": { "type": "string" }
    },
    "logo": { "type": "string" },
    "logoDark": {
      "type": "string",
      "description": "Relative path to logo asset for dark UI theme."
    },
    "rules": {
      "oneOf": [
        { "type": "string" },
        { "type": "array", "items": { "type": "string" } }
      ]
    },
    "skills": {
      "oneOf": [
        { "type": "string" },
        { "type": "array", "items": { "type": "string" } }
      ]
    },
    "agents": {
      "oneOf": [
        { "type": "string" },
        { "type": "array", "items": { "type": "string" } }
      ]
    },
    "commands": {
      "oneOf": [
        { "type": "string" },
        { "type": "array", "items": { "type": "string" } }
      ]
    },
    "hooks": {
      "oneOf": [
        { "type": "string" },
        { "type": "object" }
      ]
    },
    "mcpServers": {
      "oneOf": [
        { "type": "string" },
        { "type": "object" },
        { "type": "array" }
      ]
    },
    "variables": { "type": "object" }
  }
}
