{
  "name": "platform-kubernetes",
  "description": "Glob-scoped Kubernetes and Helm guidance plus a manifest-review skill.",
  "version": "1.0.2",
  "license": "MIT",
  "displayName": "Platform Kubernetes",
  "logo": "../../assets/brand/logo.svg",
  "logoDark": "../../assets/brand/logo-dark.svg"
}
