{
  "name": "jira-workflow",
  "description": "Skills-only Jira issue triage and workflow guidance using user-connected MCP tools.",
  "version": "1.0.2",
  "license": "MIT",
  "displayName": "Jira Workflow",
  "logo": "../../assets/brand/logo.svg",
  "logoDark": "../../assets/brand/logo-dark.svg"
}
