{
  "name": "frontend-javascript",
  "description": "Glob-scoped JavaScript and TypeScript client guidance for typed boundaries and existing bundlers.",
  "version": "1.1.0",
  "license": "MIT",
  "displayName": "Frontend JavaScript",
  "logo": "assets/logo.svg",
  "logoDark": "assets/logo-dark.svg"
}
